event_id,event_title,event_type,first_eval_date,last_eval_date,first_trade_date,last_trade_date,rebalance_rows,unique_names
EVT001,US CHIPS and Science Act signed,policy_regulation,2022-08-18,2022-08-18,2022-08-19,2022-08-19,1,1
EVT002,US tightened advanced AI chip export controls to China,tariff_trade,2023-10-18,2023-11-15,2023-10-19,2023-11-16,9,3
EVT003,US Inflation Reduction Act signed,policy_regulation,2022-08-17,2022-09-16,2022-08-18,2022-09-19,5,2
EVT004,US announced tariff increases on selected Chinese EV battery and clean-tech imports,tariff_trade,2024-05-16,2024-06-14,2024-05-17,2024-06-17,5,1
EVT006,OPEC+ announced a surprise oil output cut,commodity_shock,2023-04-04,2023-05-03,2023-04-05,2023-05-04,4,2
EVT007,China formally dismantled major zero-COVID restrictions,policy_regulation,2022-12-08,2023-01-06,2022-12-09,2023-01-09,5,3
EVT008,China resumed outbound group travel on a pilot basis,policy_regulation,2023-02-07,2023-03-08,2023-02-08,2023-03-09,5,2
