Axis,BaselineValue,CandidateValue,Delta,Verdict,Note
full_period_cagr,0.626922798196353,0.6315699672750634,0.004647169078710434,promote,headline CAGR improved without extra drawdown
full_period_sharpe,1.689757073836905,1.6892405803253625,-0.0005164935115424818,promote,Sharpe improved while MDD stayed flat
walkforward_avg_cagr_delta,0.0,0.00474323503904317,0.00474323503904317,promote,"positive CAGR windows=3, negative=0"
cost_latest_cagr_delta,0.0,0.0042449331421514636,0.0042449331421514636,promote,cost points ahead=5
candidate_avg_monthly_delta,0.0,0.00041474232096736435,0.00041474232096736435,promote,candidate clears promotion with a positive average monthly delta over the retired strongest
top3_positive_symbol_share,0.7408021635970187,0.7307004248166477,-0.010101738780371017,caution,concentration remains elevated and does not broaden the edge versus the retired strongest
benchmark_cost_75bps_cagr_delta,0.11065661275468064,0.1149015458968321,0.0042449331421514636,promote,candidate stays ahead of hard benchmark even at 75 bps
universe_split_full_vs_retired,0.0,0.004647169078710434,0.004647169078710434,promote,mixed-universe strong branch improved where the branch family actually wins
universe_split_stock_only_vs_retired,0.0,0.0,0.0,caution,not a universal stock-only improvement; interpretation remains mixed-universe
